[
  {
    "id": "g5v1_001",
    "word": "telescope",
    "phonetic": "/ˈtel.ɪ.skoʊp/",
    "chinese": ["望远镜"],
    "sentence": "I looked at the stars through a telescope.",
    "image_url": ""
  },
  {
    "id": "g5v1_002",
    "word": "adventure",
    "phonetic": "/ədˈven.tʃər/",
    "chinese": ["冒险", "奇遇"],
    "sentence": "The children went on an exciting adventure.",
    "image_url": ""
  },
  {
    "id": "g5v1_003",
    "word": "beautiful",
    "phonetic": "/ˈbjuː.t̬ə.fəl/",
    "chinese": ["美丽的", "漂亮的"],
    "sentence": "The sunset is beautiful tonight.",
    "image_url": ""
  },
  {
    "id": "g5v1_004",
    "word": "curious",
    "phonetic": "/ˈkjʊr.i.əs/",
    "chinese": ["好奇的"],
    "sentence": "She was curious about the mysterious box.",
    "image_url": ""
  },
  {
    "id": "g5v1_005",
    "word": "discover",
    "phonetic": "/dɪˈskʌv.ər/",
    "chinese": ["发现"],
    "sentence": "Scientists discovered a new planet.",
    "image_url": ""
  },
  {
    "id": "g5v1_006",
    "word": "enormous",
    "phonetic": "/ɪˈnɔːr.məs/",
    "chinese": ["巨大的", "庞大的"],
    "sentence": "The elephant is an enormous animal.",
    "image_url": ""
  },
  {
    "id": "g5v1_007",
    "word": "fantastic",
    "phonetic": "/fænˈtæs.tɪk/",
    "chinese": ["极好的", "了不起的"],
    "sentence": "We had a fantastic time at the party.",
    "image_url": ""
  },
  {
    "id": "g5v1_008",
    "word": "generous",
    "phonetic": "/ˈdʒen.ər.əs/",
    "chinese": ["慷慨的", "大方的"],
    "sentence": "He is very generous with his time.",
    "image_url": ""
  },
  {
    "id": "g5v1_009",
    "word": "important",
    "phonetic": "/ɪmˈpɔːr.tənt/",
    "chinese": ["重要的"],
    "sentence": "Education is important for everyone.",
    "image_url": ""
  },
  {
    "id": "g5v1_010",
    "word": "journey",
    "phonetic": "/ˈdʒɜːr.ni/",
    "chinese": ["旅行", "旅程"],
    "sentence": "Our journey across the country was amazing.",
    "image_url": ""
  }
]
